标题,价格,店铺,月成交量,评价数
花花公子男士纯棉立领秋季韩版打底衫,¥139.00,playboy辉腾专卖店,月成交 2471笔,评价 8574
花花公子旗舰男士韩版纯棉v领polo衫,¥139.00,playboy邦妮专卖店,月成交 1261笔,评价 4233
花花公子男士夏季polo衫,¥139.00,铃榕鞋类专营店,月成交 1959笔,评价 928
花花公子夏季圆领韩版t恤,¥139.00,铃榕鞋类专营店,月成交 2558笔,评价 2290
花花公子男士圆领韩版印花薄款潮衣,¥139.00,playboy辛铖专卖店,月成交 2443笔,评价 7781
七匹狼夏季男士宽松中年潮流t恤,¥149.00,七匹狼威派专卖店,月成交 5617笔,评价 3.4万
马克华菲男士纯棉夏季白色t恤,¥128.00,马克华菲智永专卖店,月成交 1508笔,评价 2362
南极人韩版潮流男士商务翻领polo衫,¥89.00,香凝服饰专营店,月成交 3281笔,评价 2.1万
七匹狼男士纯棉宽松潮流polo衫,¥169.00,七匹狼康成专卖店,月成交 2448笔,评价 5237
马克华菲夏季潮流白色圆领纯棉t恤,¥138.00,马克华菲康百专卖店,月成交 5519笔,评价 7234
七匹狼男士夏季圆领青年宽松t恤,¥149.00,七匹狼立淘专卖店,月成交 2009笔,评价 2.1万
南极人男士翻领韩版潮流夏季上衣,¥69.00,南极人昊通专卖店,月成交 1.1万笔,评价 1.3万
马克华菲男士潮流夏季纯棉打底衫,¥168.00,马克华菲智永专卖店,月成交 2690笔,评价 4996
南极人纯色圆领白色大码学生男士t恤,¥69.00,南极人酷小孩专卖店,月成交 3.5万笔,评价 1.5万
马克华菲男士春季圆领打底衫,¥148.00,马克华菲胜达专卖店,月成交 2612笔,评价 3844
南极人潮流学生嘻哈帅气男士打底衫,¥69.00,曙兴服饰专营店,月成交 2.4万笔,评价 5939
马克华菲男士白色纯棉潮牌绣衣,¥128.00,马克华菲艾贝尔专卖店,月成交 2323笔,评价 1356
太平鸟夏季纯色纯棉韩版青年打底衫,¥99.90,太平鸟男装旗舰店,月成交 1.1万笔,评价 4.1万
恒源祥男士春秋款条纹韩版中青年衬衣,¥148.00,众客服饰专营店,月成交 2798笔,评价 1665
2件】夏装男士短袖t恤2019新款潮流上宽松半袖春装男生打底衫,¥69.00,南极人欧驰专卖店,月成交 1.2万笔,评价 2283
恒源祥中老年爸爸大码宽松打底衫,¥179.00,恒源祥羽绒服饰旗舰店,月成交 2384笔,评价 9495
七匹狼潮流宽松翻领男士polo衫,¥189.00,七匹狼搜客专卖店,月成交 665笔,评价 207
恒源祥中年男士圆领爸爸纯棉薄款t恤,¥135.00,三织服饰专营店,月成交 698笔,评价 901
七匹狼男士夏季圆领中年t恤,¥159.00,七匹狼搜客专卖店,月成交 314笔,评价 48
美特斯邦威休闲纯色潮流纯棉打底衫,¥39.00,美特斯邦威官方网店,月成交 6.9万笔,评价 16万
太平鸟旗舰店纯色情侣打底衫,¥99.90,太平鸟男装旗舰店,月成交 1.8万笔,评价 5786
与狼共舞夏季男士修身潮流t恤,¥149.00,与狼共舞立淘专卖店,月成交 2442笔,评价 6343
与狼共舞夏季纯棉潮流男士圆领t恤,¥89.00,与狼共舞立淘专卖店,月成交 2099笔,评价 5685
森马圆领套头字母印花休闲布衣,¥69.90,森马官方旗舰店,月成交 3461笔,评价 2687
连帽男士春秋款春季休闲运动服套装,¥178.00,嘟哆斯堡旗舰店,月成交 6155笔,评价 2.6万
春秋款潮流男士春季休闲运动套装,¥198.00,慕盼旗舰店,月成交 5993笔,评价 1.7万
翻领莫代尔休闲纯色衬衣,¥89.00,横行道旗舰店,月成交 3057笔,评价 3307
恒源祥爸爸圆领全棉宽松中年男士t恤,¥135.00,三织服饰专营店,月成交 325笔,评价 685
森马男士青少年纯色纯棉白色潮流t恤,¥49.90,森马官方旗舰店,月成交 3.0万笔,评价 8.0万
【2件69】纯棉短袖T恤女装条纹宽松韩版半袖夏装2019新款上潮,¥69.90,时尚解放朵然专卖店,月成交 4293笔,评价 3.2万
布先生中年商务休闲翻领上衣,¥268.00,布先生旗舰店,月成交 1328笔,评价 7420
2件69.9】纯棉宽松T恤女短袖韩版半袖体恤上夏装2019女装新款,¥69.90,时尚解放朵然专卖店,月成交 2954笔,评价 1.4万
竹节棉宽松纯色七分袖大码打底衫,¥69.00,横行道旗舰店,月成交 4369笔,评价 2.0万
恒源祥男士夏季翻领中年纯色t恤,¥158.00,恒源祥微然专卖店,月成交 495笔,评价 2.3万
森马夏季男士潮牌港风运动宽松t恤,¥59.90,森马妙步专卖店,月成交 2929笔,评价 1051
美特斯邦威休闲字母韩版潮流男士t恤,¥79.90,美特斯邦威官方网店,月成交 5848笔,评价 2019
春季薄款冰丝针织春秋打底衫,¥138.00,玛思狄拉旗舰店,月成交 928笔,评价 562
韩版v领春季薄款春秋打底衫,¥138.00,玛思狄拉旗舰店,月成交 3037笔,评价 2381
2件69.9】春秋季长袖t恤女装宽松韩版打底小衫春装2019新款上,¥69.90,时尚解放旗舰店,月成交 4549笔,评价 1.0万
2件】莫代尔长袖t恤男圆领春季上衣纯色打底衫春装内搭小衫秋,¥79.00,notee男装旗舰店,月成交 9647笔,评价 2.1万
春秋休闲春季帅气男士三件套,¥188.00,志肯旗舰店,月成交 6907笔,评价 5804
唐狮潮流夏季纯棉圆领学生宽松t恤,¥59.00,唐狮官方旗舰店,月成交 1.5万笔,评价 5323
2件69.9】中袖t恤女装纯棉宽松短袖半袖上五分袖夏装2019新款,¥69.90,时尚解放旗舰店,月成交 2992笔,评价 666
罗蒙修身夏季青年潮流职业装,¥159.00,罗蒙信阳专卖店,月成交 1322笔,评价 894
G2000衬衫男长袖防皱商务男装 工作休闲正装修身薄款白色衬衣,¥159.00,G2000官方旗舰店,月成交 4670笔,评价 2.6万
布先生丝光商务翻领纯棉t恤,¥258.00,布先生旗舰店,月成交 2071笔,评价 8769
男女情侣款周年合作款t恤,¥59.80,ciikamou西卡摩旗舰店,月成交 1634笔,评价 188
唐狮夏季纯色圆领韩版渐变t恤,¥59.00,唐狮官方旗舰店,月成交 4128笔,评价 1.7万
2件】莫代尔男士短袖t恤夏季男装圆领纯色修身潮流冰丝半袖丅,¥65.00,notee男装旗舰店,月成交 3.1万笔,评价 9559
【2件59元】春秋上衣女新款长袖T恤女黑色打底衫韩版春装2019,¥55.00,遇上旗舰店,月成交 9778笔,评价 4906
法兰王男士纯棉休闲青年磨毛修身衬衣,¥88.00,法兰王旗舰店,月成交 5501笔,评价 4.0万
圆领潮流男士春秋款运动休闲打底衫,¥95.00,兆波服饰专营店,月成交 3238笔,评价 5971
男士纯棉青年纯色韩版牛仔衬衣,¥45.90,yiwen易文男装旗舰店,月成交 1.6万笔,评价 8.4万
连帽春秋款春季运动套装,¥178.00,慕盼旗舰店,月成交 1125笔,评价 8133
dickies经典logo夏季男士圆领潮流t恤,¥219.00,dickies迪酷专卖店,月成交 259笔,评价 131
